{
  "version": "2.0.0",
  "description": "Test fixture for v2 target-centric mapping spec.",
  "architectures": ["aarch64", "x86_64"],
  "targets": {
    "default_packages.json": {
      "transform": {
        "exclude_fields": ["architecture"]
      },
      "sources": [
        {
          "source_file": "base_os.json",
          "pulls": [
            {"source_key": "Base OS", "target_key": "default_packages"}
          ]
        }
      ]
    },
    "service_k8s.json": {
      "transform": {
        "exclude_fields": ["architecture"]
      },
      "sources": [
        {
          "source_file": "functional_layer.json",
          "pulls": [
            {"source_key": "K8S Controller", "target_key": "service_kube_control_plane"},
            {"source_key": "K8S Worker", "target_key": "service_kube_node"}
          ]
        }
      ],
      "derived": [
        {
          "target_key": "service_k8s",
          "operation": {
            "type": "extract_common",
            "from_keys": ["service_kube_control_plane", "service_kube_node"],
            "min_occurrences": 2,
            "remove_from_sources": true
          }
        }
      ]
    },
    "slurm_custom.json": {
      "transform": {
        "exclude_fields": ["architecture"]
      },
      "sources": [
        {
          "source_file": "functional_layer.json",
          "pulls": [
            {"source_key": "Login Node", "target_key": "login_node"},
            {"source_key": "Compiler", "target_key": "login_compiler_node"},
            {"source_key": "Slurm Controller", "target_key": "slurm_control_node"},
            {"source_key": "Slurm Worker", "target_key": "slurm_node"}
          ]
        }
      ],
      "derived": [
        {
          "target_key": "slurms_custom",
          "operation": {
            "type": "extract_common",
            "from_keys": ["login_node", "login_compiler_node", "slurm_control_node", "slurm_node"],
            "min_occurrences": 2,
            "remove_from_sources": true
          }
        }
      ]
    }
  }
}
